Company_Brand,Founded,HeadQuarter,Sector,What_it_does,Founders,Investor,Amount,Stage,year,Amount in Millions
Newton School,2019.0,Bangalore,Technology,Newton School is a platform to learn and develop skills that you need for your best Tech career.,"Nishant Chandra, Siddharth Maheshwari","RTP Global, Harshil Mathur",5000000.0,Series,2021,5.0
TenderCuts,2011.0,Chennai,"Food, Hospitality, Tourism & Travel","TenderCuts is an online meat shop that delivers antibiotic-free, hygienic, and farm fresh chicken, free range goat, and seafood.",Nishanth Chandran,"Paragon Partners, NABVENTURES",15000000.0,Seed,2021,15.0
Siply,2020.0,Bangalore,Technology,Siply Services operates as a micro-savings platform.,"Sousthav Chakrabarty, Anil Bhat",Inflection Point Ventures,1000000.0,Seed,2021,1.0
SarvaGram,2019.0,Mumbai,Technology,SarvaGram provides livelihood upgradation for aspiring households based in rural and semi-urban India.,"Utpal Isser, Sameer Mishra",Elevation Capital,10000000.0,Series,2021,10.0
Unlu,2020.0,Gurugram,Technology,Personalised Video Shoutout from top celebrities,"Akshay Pruthi, Anurag Dalia, Himanshu Periwal, Vipul Agrawal",EXPERT DOJO,1000000.0,Seed,2021,1.0
GlobalFair,2020.0,Gurugram,Finance,One-stop solution for all your procurement needs,"Ashish Chandra, Shaily Garg","Saama Capital, India Quotient",2000000.0,Seed,2021,2.0
Eduvanz,2016.0,Mumbai,Technology,"Eduvanz is new, innovative finance company, which is completely revolutionizing the student loan market.","Atul Sashittal, Raheel Shah, Varun Chopra","InCred Financial Services, Vivriti Capital, Northern Arc Capital",10000000.0,Debt,2021,10.0
OwO,2020.0,Gurugram,E-Commerce & Retail,"Shop packaged drinking water, beverages from your favorite brands i.e. Kinley, Bisleri, Aquafina, Coca-cola, Pepsi etc",Hardev Sahu,ah! Ventures,200000.0,Seed,2021,0.2
Progcap,2017.0,New Delhi,Technology,Progcap is a financial service company that provides financial opportunities for micro and small businesses in the last mile.,"Pallavi Shrivastava, Himanshu Chandra","Somak Ghosh, M V Nair",1000000.0,Debt,2021,1.0
ABL Workspaces,2017.0,New Delhi,Technology,ABL Workspaces is a co-working space where professionals from all walks of life come to work under one roof.,"Ankur Gupta, Akshita Gupta",Wurk,600000.0,Series,2021,0.6
Nazara Technologies,2000.0,Mumbai,"Fashion, Sports, Entertainment, Media & Arts","Nazara Technologies develops mobile content such as games, themes, wallpapers, and multimedia.",Nitish Mittersain,"Plutus Wealth Management, Turtle Entertainment",10000000.0,Seed,2021,10.0
Scentials,2018.0,Mumbai,Technology,Scentials is building a unique beauty brands studio platform,"Mahesh Bhupathi, Jinesh Mehta","Ambiga Subramanian, Goutham Ekollu",6000000.0,Seed,2021,6.0
SplashLearn,2018.0,Hyderabad,Technology,SplashLearn is an EdTech startup company providing game-based math and reading courses to students in pre-kindergarten to grade five.,"Arpit Jain, Joy Deep Nath, Mayank Jain, Umang Jain","Accel, Owl Ventures",18000000.0,Series,2021,18.0
Maya,2016.0,Bangalore,Technology,Maya enables women to keep track of their health via a mobile application.,John Paul,Rajan Anadan,2200000.0,Seed,2021,2.2
GoTo,2020.0,Ghaziabad,Transport & Logistics,Real Time Intercity City Transit Platform For 1.25 Bn People In India,"Akhilesh Sagar, Harsh Vardhan Sharma",Jesse Lucas,150000.0,Seed,2021,0.15
MediBuddy,2000.0,Bangalore,Technology,MediBuddy is a Trusted Digital Platform for Cashless Healthcare. MediBuddy connects patients with doctors and hospitals.,"atish Kannan, Enbasekar","IDFC Private Equity, Bessemer Venture Partners",40000000.0,Series,2021,40.0
Zetwerk,2018.0,Bangalore,E-Commerce & Retail,Zetwerk is an online marketplace that connects buyers and suppliers for manufacturing jobs.,"Amrit Acharya, Rahul Sharma, Srinath Ramakkrushnan, Vishal Chaudhary","Sequoia Capital India, Accel",120000000.0,Series,2021,120.0
Remedico,2017.0,Hyderabad,Technology,Remedico is a Mobile healthcare,Ranjit Bhatia,"Venture Catalysts, Tahseen Consulting",500000.0,Seed,2021,0.5
PrepBytes,2019.0,Hyderabad,Technology,PrepBytes helps college students to learn coding by personalizing their content along with the guidance of expert mentors from industry,"Aditya Bhushan Verma, Mamta Kumari",Equanimity Ventures,3500000.0,Seed,2021,3.5
SATYA MicroCapital,2017.0,New Delhi,Technology,Satya MicroCapital is a micro finance company based on a group lending model that allows borrowers to share liability.,Vivek Tiwari,"BlueOrchard Finance S A, Gojo & Company",20000000.0,Seed,2021,20.0
YourPhysio,2020.0,Nagpur,Technology,YourPhysio is a healthcare company on a mission to deliver 10x better patient experience in the domain of physiotherapy.,"Dr Sheetal Mundhada, Ashutosh Mundhada","Better Capital, Titan Capital",350000.0,Pre-seed,2021,0.35
Aviom Housing Finance,2016.0,New Delhi,Technology,AVIOM India is an Affordable Housing Finance company facilitating families in mostly semi urban areas in realising their dream of owning their first home.,Kajal Ilmi,Gojo & Company,1000000.0,Debt,2021,1.0
Hemp Horizons,2017.0,Noida,Technology,Cannabis and Hemp company,Rohit Shah,Mumbai Angels,200000.0,Seed,2021,0.2
MPL,2018.0,Bangalore,"Fashion, Sports, Entertainment, Media & Arts",Mobile Premier League is a skill-based eSports platform used to offer cash prizes while playing games.,"Sai Srinivas Kiran G, Shubham Malhotra","Pegasus Tech Ventures, Base Partners",95000000.0,Seed,2021,95.0
Koo,2020.0,Bangalore,"Fashion, Sports, Entertainment, Media & Arts",Koo App operates as a microblogging app.,"Mayank Bidawatka, Aprameya Radhakrishna","3one4 Capital, Accel",4100000.0,Series,2021,4.1
InnerHour,2016.0,Mumbai,Technology,InnerHour is mental health and wellness platform that provides therapy and diagnostics services and conducts online mental health workshops.,Amit Malik,"Hitesh Oberoi, Lightbox",5200000.0,Series,2021,5.2
Origo,2010.0,Gurugram,Technology,"Origo Commodities, a complete post-harvest management financial solution for agricultural commodities.","Sunoor Kaul, Mayank Dhanuka",YES Bank,10000000.0,Debt,2021,10.0
ExMyB,2018.0,Gurugram,Services,ExMyB provides financial service and consulting services.,Nishant Behl,Campus Fund,3500000.0,Seed,2021,3.5
Elucidata,2015.0,New Delhi,Technology,Elucidata Corporation uses data analytics to transform decision-making processes in R&D labs in biotechnology and pharmaceutical companies.,"Abhishek Jha, Richard Kibbey, Swetabh Pathak",Hyperplane Venture Capital,5000000.0,Series,2021,5.0
Saveo,2019.0,Bangalore,Technology,Saveo operates a business-to-business e-commerce platform focused on pharmacies.,"Amit Kumar, Anurag Savarnya, Shivansh Shrivastava, Vivek Jaiswal","Matrix Partners India, RTP Global",4000000.0,Seed,2021,4.0
Qin1,2019.0,Noida,Technology,Re-imagining Kids of 21st Century!,Ishan Gupta,Venture Catalysts,3500000.0,Series,2021,3.5
DotPe,2019.0,Gurugram,Technology,"DotPe is an innovative offline technology platform digitising merchant's customer engagement with mobile discovery, ordering and payments.","Anurag Gupta, Gyanesh Sharma, Shailaz Nag","Info Edge, Ruizheng Investment",8000000.0,Seed,2021,8.0
Taskmo,2018.0,Bangalore,Technology,Gig Economy Platform | Task Fulfillment Platform | New-age fulfillment solutions,"Prashant Janadari, Naveen Ramchandra",Quess Corp India,1400000.0,Seed,2021,1.4
MasterMentors,2019.0,West Bengal,Technology,India's first online platform for mentors enabling them to translate their expertise into a profitable online course,"Suraj Juneja, Vijay Rachh, and Aaquib Hussain",Inflection Point Ventures,1500000.0,Seed,2021,1.5
KIKO TV,2020.0,Mumbai,E-Commerce & Retail,KIKO TV is an AI-based short live video e-commerce platform.,Shivam Varshney,"Sunil Kumar Singhvi, 9Unicorns Accelerator Fund",3500000.0,Series,2021,3.5
Quali55Care,2018.0,Mumbai,Technology,Deliver highly durable & affordable medical equipments on rental and sale.,Harddik K Patel,India Accelerator’s Angel Investor Network,3500000.0,Seed,2021,3.5
Ruptok,2020.0,New Delhi,Technology,Ruptok operates as a fintech platform for gold loans,"Ankur Gupta, Akshita Gupta, Yashwardhan Aeren",Wurk,10000000.0,Seed,2021,10.0
RevFin,2018.0,New Delhi,Technology,RevFin is a digital lending company.,Sameer Aggarwal,Shell Foundation,3500000.0,Seed,2021,3.5
SeeVC,2020.0,New Delhi,Technology,Leverages artificial intelligence (AI) to build products for the education sector,"Shivam Sood, Lark Aakarshan",Jimmy Singh,1000000.0,Seed,2021,1.0
Junio,2020.0,New Delhi,Technology,Junio is a kids-focused digital pocket money-smart card.,Shankar Nath,"Kunal Shah, Deepak Abbot",1000000.0,Seed,2021,1.0
VenWiz,2020.0,Tamil Nadu,E-Commerce & Retail,Digitising the interactions between core industry and vendors for engineering services,"Rajesh Reddy, Sandesh Paturi","Accel, Nexus Venture",300000.0,Seed,2021,0.3
Vista Rooms,2015.0,Mumbai,Technology,"Vista Rooms is a South Asia's largest luxury holiday home rental management company. We are on a mission to build the ""Marriott for Homes""","Amit Damani, Ankita Sheth, Pranav Maheshwari","Singapore Angel Network, Artha India Ventures",1000000.0,Seed,2021,1.0
Makers Hive,2018.0,Hyderabad,Technology,"Makers Hive has made it possible to bring the people with amputations together by developing a fully functional, customizable",Pranav Vempati,"Starfish Growth Partners, Investpad",9000000.0,Seed,2021,9.0
Headfone,2017.0,Bangalore,"Fashion, Sports, Entertainment, Media & Arts",Headfone helps create and share the audio content with listeners.,"Pratham Khandelwal, Yogesh Sharma",Hashed,3000000.0,Seed,2021,3.0
Zouk,2016.0,Mumbai,"Fashion, Sports, Entertainment, Media & Arts",100% Vegan bags from India.,Disha Singh,Titan Capital,3500000.0,Seed,2021,3.5
MPL,2018.0,Bangalore,"Fashion, Sports, Entertainment, Media & Arts",Mobile Premier League is a skill-based eSports platform used to offer cash prizes while playing games.,"Sai Srinivas Kiran G, Shubham Malhotra","Pegasus Tech Ventures, Base Partners",5000000.0,Seed,2021,5.0
GrowFix,2020.0,Bangalore,Technology,Building high-yield Debt assets for retail investors,"Ajinkya Kulkarni, Abhik Patel","Zerodha's Rainmatter Capital, Better Capital",2000000.0,Seed,2021,2.0
Bombay Shaving Company,2016.0,New Delhi,"Fashion, Sports, Entertainment, Media & Arts","Bombay Shaving Company is a consumer goods company that focuses on developing a range of shave care, beard care, and skincare products.","Deepu Panicker, Raunak Munot, Rohit Jaiswal, Shantanu Deshpande","Sixth Sense Ventures, Colgate Palmolive",6000000.0,Seed,2021,6.0
Dunzo,2015.0,Bangalore,E-Commerce & Retail,Dunzo is a hyper-local delivery app that connects users to the nearest delivery partner.,"Ankur Aggarwal, Dalvir Suri, Kabeer Biswas, Mukund Jha","Lightbox, Evolvence India Fund",40000000.0,Series,2021,40.0
BeyondSkool,2020.0,Mumbai,Technology,BeyondSkool is a live upskilling platform for kids,Payal Gaba,Tomorrow Capital,2000000.0,Seed,2021,2.0
Mindler,2015.0,New Delhi,Technology,Mindler is a career counseling company that provides career development guidance counseling services for students.,Prateek Bhargava,"Inflection Point Ventures, DLabs",1000000.0,Series,2021,1.0
Fashinza,2020.0,Gurugram,E-Commerce & Retail,Fashinza is a B2B manufacturing marketplace that solves apparel/fashion supply chain challenges.,"Abhishek Sharma, Pawan Gupta","Accel Partners, Elevation Capital",2600000.0,Seed,2021,2.6
BharatPe,2018.0,Tamil Nadu,Technology,BharatPe develops a QR code-based payment app for offline retailers and businesses.,"Ashneer Grover, Shashvat Nakrani","InnoVen Capital, Steadview Capital",6000000.0,Debt,2021,6.0
Turnip,2020.0,Bangalore,"Fashion, Sports, Entertainment, Media & Arts",Turnip is a live game streaming and community platform.,"Aditya Sharma, Pooja Dubey",Elevation Capital,1600000.0,Seed,2021,1.6
Furlenco,2012.0,Bangalore,Real Estate,Furlenco is a subscription-based furniture rental platform that allows users to rent furniture on a monthly basis.,Ajith Karimpana,BlackSoil Capital,2000000.0,Seed,2021,2.0
Inficold,2015.0,New Delhi,Technology,Provide uninterrupted and affordable cooling for refrigeration,"Himanshu Pokharna, Nitin Goel",Shell Foundation,900000.0,Series,2021,0.9
KIWI,2020.0,New Delhi,Technology,"A peer to peer support network, which would enable billions of users across the world","Imran Ladiwala, Mishu Ahluwalia","PointOne Capital, Core91 VC",250000.0,Seed,2021,0.25
Digit Insurance,2016.0,Bangalore,Technology,Digit Insurance is a financial services company that general insurance services.,Kamesh Goyal,"A91 Partners, Faering Capital",3500000.0,Seed,2021,3.5
BharatPe,2018.0,New Delhi,Technology,BharatPe develops a QR code-based payment app for offline retailers and businesses.,"Ashneer Grover, Shashvat Nakrani","InnoVen Capital, Steadview Capital",10000000.0,Debt,2021,10.0
MFine,2017.0,Bangalore,Technology,Mfine is an health-tech startup that offers an AI-powered online doctor consultation app.,"Ajit Narayanan, Ashutosh Lawania, Prasad Kompalli","Blockchain Capital, SBI Ven Capital",16000000.0,Seed,2021,16.0
Udayy,2019.0,Gurugram,Technology,Interactive learning platform for kids,"Saumya Yadav, Mahak Garg, Karan Varshney",Alpha Wave Incubation,2500000.0,Seed,2021,2.5
Lohum,2017.0,Noida,Technology,Lohum manufactures lithium-ion battery packs and recovers critical battery materials from used lithium-ion batteries through recycling.,Rajat Verma,"Baring Private Equity Partners India, Talbros",7000000.0,Seed,2021,7.0
Darwinbox,2015.0,Hyderabad,Technology,Darwinbox is an end-to-end enterprise HR software that enables enterprises to automate entire employee lifecycle in one HR platform.,"Chaitanya Peddi, Jayant Paleti, Rohit Chennamaneni","Sequoia Capital India, 3one4 Capital",15000000.0,Seed,2021,15.0
DeHaat,2012.0,Patna,Technology,DeHaat connects farmers to suppliers and buyers on a single platform.,"Shashank Kumar, Manish Kumar","Prosus Ventures, RTP Global",30000000.0,Series,2021,30.0
Samunnati,2014.0,Chennai,Technology,Samunnati is a specialized agriculture value chain enabler providing innovative and customized financial and non-financial solutions.,Anil Kumar,"U.S. International Development Finance Corp, responsAbility",10000000.0,Debt,2021,10.0
Biconomy,2019.0,New Delhi,Technology,Biconomy is a technology company building transaction infrastructure for next-generation Web 3 applications.,"Ahmed Al-Balaghi, Aniket Jindal, Sachin Tomar","Binance Labs, Zee Prime Capital",1500000.0,Seed,2021,1.5
True Elements,2011.0,Pune,"Food, Hospitality, Tourism & Travel","Committed to improving the quality of life, True Elements provides food that is packed with the goodness of nature!","Puru Gupta, Sreejith Moolayil",RP-Sanjiv Goenka Group,1000000.0,Seed,2021,1.0
Siply,2020.0,Bangalore,Technology,Siply Services operates as a micro-savings platform.,Sousthav Chakrabarty,Inflection Point Ventures,1000000.0,Seed,2021,1.0
Nao Spirits & Beverages Pvt Ltd,2016.0,New Delhi,"Food, Hospitality, Tourism & Travel",India's first Craft Gin company,Anand Virmani,Inflection Point Ventures,2000000.0,Series,2021,2.0
PurpleTutor,2019.0,Mumbai,Technology,PurpleTutor is the only coding platform that mandates every teacher to have a formal Computer Science degree,"Gaurav Perti, Yatish Gupta",IvyCap Ventures,300000.0,Seed,2021,0.3
Karkhana.io,2018.0,Mumbai,Technology,Karkhana.io is an on-demand manufacturing platform with a vision of digitalizing manufacturing.,Sonam Motwani,Zone Startups In,1500000.0,Seed,2021,1.5
SSA Finserv,2019.0,Mumbai,Technology,Small businesses-focused non-banking lender,Vikas Agarwal,Blue Ashva Capital,3000000.0,Seed,2021,3.0
CoinSwitch Kuber,2017.0,Bangalore,Finance,Coinswitch.co is a cryptocurrency exchange aggregator platform.,"Ashish Singhal, Govind Soni, Vimal Sagar Tiwari","Ribbit Capital, Kunal Shah",15000000.0,Series,2021,15.0
Paperfly,2016.0,Bangalore,E-Commerce & Retail,Paperfly is an e-commerce fulfillment and nationwide delivery solution in Bangladesh,"Shahriar Hasan, Md Razibul Islam, Rahath Ahmed, Shamsuddin Ahmed",Ecom Express,11000000.0,Seed,2021,11.0
Infra.Market,2016.0,Thane,E-Commerce & Retail,Infra.Market is an online procurement marketplace for every category of materials and products needed for building projects.,"Souvik Sengupta, Aaditya Sharda",InnoVen Capital,6000000.0,Debt,2021,6.0
ReadyAssist,2018.0,Bangalore,Technology,"ReadyAssist is one of the India's leading 24/7 roadside assistance, breakdown support, towing and repairs provider for both Bikes & Cars.",Vimal Singh SV,Satish Grampurohit,1000000.0,Seed,2021,1.0
Chalo,2014.0,Mumbai,Technology,Chalo is a free app that tracks buses live and tells you what time your bus will reach your stop.,"Mohit Dubey, Nikhil Aggarwal","Amit Singhal, Raine Ventures",7000000.0,Seed,2021,7.0
Udaan,2016.0,Bangalore,E-Commerce & Retail,"Udaan is a B2B trade platform that brings manufacturers, traders, retailers, and wholesalers into a single platform","Amod Malviya, Sujeet Kumar, Vaibhav Gupta","Octahedron Capital, Moonstone Capital",280000000.0,Seed,2021,280.0
Unacademy,2015.0,Bangalore,Technology,Unacademy is an online learning platform providing educational content such as video lectures and examinations.,"Gaurav Munjal, Hemesh Singh, Roman Saini, Sachin Gupta","Tiger Global, Dragoneer Investment Group, Steadview Capital, General Atlantic",50000000.0,Seed,2021,50.0
Ergos,2012.0,Samsitpur,Technology,Ergos is building an integrated supply chain platform that enables farmers to convert their grains to digital assets.,"Kishor Kumar Jha, Praveen Kumar","CDC Group, Aavishkaar Venture Capital",3000000.0,Series,2021,3.0
Bolkar,2018.0,Bangalore,Other,Bolkar App is an Audio Based Q&A platform for the Next Billion Users.,"Abhishek Tripathi, Dhruv Kaushal, Prince Tripathi, Saurabh Rai","GSF, Pras Hanuma",3500000.0,Seed,2021,3.5
Wright Research,2019.0,Mumbai,Services,Quantitative Investment Management and Research,Sonam Srivastava,"Ajat Hukkoo, Piyush Chaplot",3500000.0,Pre-seed,2021,3.5
Knocksense,2016.0,Hyderabad,"Fashion, Sports, Entertainment, Media & Arts",Knocksense which owns and operates an eponymous digital content platform.,"Varul Mayank, Vibhore Mayank, Vibhore Mayank","Mumbai Angels, Amitesh Pandey",200000.0,Seed,2021,0.2
Pariksha,2015.0,Pune,Technology,"Pariksha - The Sucess App, India's largest vernacular test preparation company for the mobile 1st internet users of India","Deepak Choudhary, Karanvir Singh Shekhawat, Utkarsh Bagri, Vikram Shekhawat","Venture Catalysts, 9Unicorns Accelerator Fund",1800000.0,Seed,2021,1.8
Toothsi,2018.0,Mumbai,Technology,ToothSi is a new age startup in the dental space providing smile correction services at home.,"Dr Arpi Mehta, Dr Pravin Shetty, Dr Manjul Jain, Dr Anirudh Kale",Think Investments,5000000.0,Series,2021,5.0
Jumbotail,2015.0,Bangalore,"Food, Hospitality, Tourism & Travel","Jumbotail is solving an important problem of organising food and grocery ecosystem in India through technology, data science and design.","Ashish Jhina, Karthik Venkateswaran","Nexus Venture Partners, 23 High Networth Individuals (HNIs)",14300000.0,Series,2021,14.3
Phi Commerce,2015.0,Pune,Technology,"Payments Facilitator, Payments solution provider etc.","Anil Sharma, Jose Thattil, Rajesh Londhe, Tushar Shankar","Yatra Angel Network, BEENEXT",4000000.0,Series,2021,4.0
Zupee,2018.0,Gurugram,"Fashion, Sports, Entertainment, Media & Arts",Zupee is a skill-based gaming app that enables its users to play against each-other live,"Dilsher Singh Malhi, Siddhant Saurabh","Orios Venture Partners, Matrix Partners India",10000000.0,Seed,2021,10.0
Oneiric Gaming,2020.0,Chandigarh,"Fashion, Sports, Entertainment, Media & Arts",Oneiric Gaming connects to fellow dreamers around the globe over cult favorite games like Bluff and Cricket.,Avneet Singh,Trishneet Arora,3500000.0,Seed,2021,3.5
Finsall,2019.0,Bangalore,Technology,Finsall provides Insurance Premium Financing,"Prabal Khanna, Tim Mathews",Unicorn India Ventures,300000.0,Seed,2021,0.3
Legalwiz.in,2015.0,Ahmedabad,Technology,"LegalWiz.in is committed to provide high quality professional services for small businesses, start-up entrepreneurs and individuals.","Shrijay Sheth, Gaurav Barot",ContCentric,500000.0,Seed,2021,0.5
Practically,2018.0,Telangana,Technology,"Making Learning personal, immersive and experiental",Subbarao Siddabattula,Siana Capital,4000000.0,Series,2021,4.0
Cred,2018.0,Tamil Nadu,Technology,CRED is a Bengaluru-based fintech startup that offers rewards for customers who use its platform to pay their credit card bills.,Kunal Shah,"DST Global, General Catalyst",81000000.0,Series,2021,81.0
Devic Earth,2018.0,Bangalore,Energy & Environment,"State-of-the-art air pollution control equipment to improve air quality across buildings, industries, and cities.",Dr Srikanth Sola,Blue Ashva Capital,1000000.0,Seed,2021,1.0
Zerone,2018.0,Gurugram,Technology,"Convert smartphones into a POS machine using our ZUP proximity payment technology, with no additional hardware and no need for NFC.",Jaijit Bhattacharya,Anthill Ventures,1300000.0,Series,2021,1.3
boAt,2016.0,Mumbai,"Fashion, Sports, Entertainment, Media & Arts",boAt is a lifestyle brand that deals in fashionable consumer electronics.,"Aman Gupta, Sameer Mehta","InnoVen Capital, InnoVen Capita",100000000.0,Equity,2021,100.0
Pocket Aces,2013.0,Mumbai,"Fashion, Sports, Entertainment, Media & Arts",Pocket Aces is a digital entertainment company focused on mobile video.,"Anirudh Pandita, Aditi Shrivastava, Ashwin Suresh","3one4 Capital, DSP Group",2000000.0,Seed,2021,2.0
Kyt,2020.0,Bangalore,Technology,"An online-first, global academy for extracurricular learning | Private & small group online classes for kids","Bhavik Rathod, Tripti Ahuja",Alpha Wave Incubation,5000000.0,Series,2021,5.0
iMumz,2019.0,Bangalore,Technology,"iMumz empowers pregnant mothers to deliver healthy, happy, and intelligent babies through a positive lifestyle.","Dr Jaideep Malhotra, Rajesh Jagasia, Ravi Teja Akondi, Mayur Dhurpate","Enzia Ventures, AngelList",300000.0,Seed,2021,0.3
BharatPe,2018.0,New Delhi,Technology,BharatPe develops a QR code-based payment app for offline retailers and businesses.,"Ashneer Grover, Shashvat Nakrani","Steadview Capital, Insight Partners",8200000.0,Debt,2021,8.2
CropIn,2010.0,Bangalore,Technology,CropIn is a leading AI and Data-led agri-tech organization that provides SaaS solutions to agribusinesses globally using deep learning.,Krishna Kumar,"Invested Development, Pratithi Investment Trust",20000000.0,Series,2021,20.0
Vanity Wagon,2018.0,Haryana,HealthCare,"Vanity Wagon is India’s #1 Natural Organic Beauty Marketplace. Buy Ayurvedic Natural Beauty Products in India for skin, hair & body care.",Prateek Ruhail,"Dhianu Das, Agility Venture Partners",200000.0,Seed,2021,0.2
Oyo,2012.0,Gurugram,Technology,OYO operates a branded network of hotels designed to offer standardized stay experiences.,Ritesh Agarwal,Hindustan Media Venture,7000000.0,Series,2021,7.0
Agri10x,2018.0,Pune,Technology,Agri10x integrates the entire Agri value-chain through a digital cooperative platform by harnessing emerging technologies,"Abhijith Naraparaju, Pankajj P. Ghode, Sundeep Bose",Omnivore,3500000.0,Seed,2021,3.5
BlackSoil,2016.0,Mumbai,Technology,Blacksoil Advisory is an independent boutique advisory firm.,Ankur Bansal,Awign Enterprises,4000000.0,Seed,2021,4.0
HobSpace,2019.0,Mumbai,Technology,HobSpace is a platform for extra-curricular activities online and offline for kids between 3-14 years.,"Priya Goel Sheth, Harsh Jain","Siddharth Bhaskar Shah, Upsparks",100000.0,Series,2021,0.1
DcodeAI,2020.0,New Delhi,Technology,EMPOWER LEARNERS TO BE FUTURE READY USING AI,"Kartik Sharma, Ashish Aggarwal",S Chand,500000.0,Seed,2021,0.5
Biocon Biologics,1978.0,Bangalore,Technology,"Biocon is a fully integrated pure play biosimilars organization, globally engaged in developing high quality affordable biosimilars.",Kiran Mazumdar-Shaw,"Goldman Sachs, Tata Capital",70000000.0,Seed,2021,70.0
KiranaKart,2020.0,Mumbai,E-Commerce & Retail,A better model for instant grocery delivery in India.,"Kaivalya Vohra, Aadit Palicha",Global Founders Capital,720000.0,Pre-seed,2021,0.72
Meddo,2018.0,Gurugram,Technology,Meddo is an end-to-end medical services provider,Saurabh Kochhar,"growX ventures, Venture Gurukool",3000000.0,Series,2021,3.0
SP Robotic Works,2012.0,Chennai,Technology,An innovative place to explore next-generation technologies for students and all tech enthusiasts.,"Sneha Priya, Pranavan S",Mount Judi India Growth Fund,3000000.0,Series,2021,3.0
3SC,2018.0,Gurugram,Transport & Logistics,An end-to-end supply chain analytics company that provides execution and analytics solutions which are comprehensive and customized.,"Lalit, Sarita Das",GEF Capital’s South Asia Fund,15000000.0,Series,2021,15.0
Chai Waale,2018.0,Chennai,"Food, Hospitality, Tourism & Travel","A wide range of exotic flavoured chai, in the most hygienic ambience at pocket-friendly prices.",Vidur Maheswari,"Sunil Sethia, Sunil Kumar Singhvi, Manish Mardia",600000.0,Seed,2021,0.6
Minimalist,2020.0,Jaipur,HealthCare,Affordable skincare for all,"Mohit, Rahul Yadav",Sequoia Capital,10000000.0,Series,2021,10.0
Biconomy,2019.0,New Delhi,Technology,Developer platform to enable a simplified transaction and onboarding experience for Web3 projects,"Aniket Jindal, Sachin Tomar","Mechanism Capital, DACM",9000000.0,Seed,2021,9.0
Fixcraft,2018.0,Gurugram,Transport & Logistics,India's Most Trusted Automotive Repair Brand,"Vivek Sharma, Abhishek Goyal, Inderjeet Rao",Inflection Point Ventures,1000000.0,Series,2021,1.0
Slice,2016.0,Hyderabad,Finance,"Slice is India's best credit card challenger to pay bills, manage expenses, and unlock rewards",Rajan Bajaj,"Northern Arc Capital, Niyogin Fintech Limited, Credit Saison India, Vivriti Capital",10000000.0,Seed,2021,10.0
