Company_Brand,Founded,HeadQuarter,Sector,What_it_does,Founders,Investor,Amount,Stage,year,Amount in Millions
Bira91,2015.0,Bangalore,"Food, Hospitality, Tourism & Travel",Craft beer maker,Ankur Jain,"Sequoia Capital, Sofina",20000000.0,Series,2020,20.0
Finaureus Technologies,2017.0,Pune,Technology,Provides investment management solutions,"Arindam Ghosh, U R Bhatt",Pinetree Capital,3000000.0,Series,2020,3.0
Daily Ninja,2014.0,Haryana,E-Commerce & Retail,Online Milk Delivery startup,Sagar Yarnalkar,Big Basket,349800.0,Series,2020,0.3498
Guvi Geek Network Pvt Ltd,2014.0,Chennai,Technology,Operates vernacular-language based education,"SP Balamurugan, Arun Prakash, Sri Devi",Education Catalyst Fund,786000.0,Series,2020,0.786
LoadShare,2017.0,Bangalore,Transport & Logistics,Provides technology based solutions to SMEs in logistics,"Raghuram Talluri, Tanmoy Karmakar, Rakib Ahmed",CDC Group,2004000.0,Series,2020,2.004
Vedantu,2016.0,Bangalore,Technology,Onine learning platform,"Saurabh Saxena, Pulkit Jain, Anand Prakash, Vamsi Krishna",KB Global Platform Firm,6800000.0,Series,2020,6.8
Indusface,2004.0,Bangalore,Technology,It provides IT security solutions,"Venkatesh Sundar, Nandini Tandon",Tata Capital Growth Fund II,5000000.0,Series,2020,5.0
DMI Group,2008.0,New Delhi,Finance,Pan-India Credit providing platform,"Shivashish Chatterjee, Yuvraja Singh",NXC Corporation,123000000.0,Series,2020,123.0
Spintly,2017.0,Goa,Technology,It is a wireless cloud-based access control system,"Rohin Parkar, Malcolm Dsouza",Saltwater Venture Sparks,248000.0,Series,2020,0.248
Credr,2014.0,Mumbai,Technology,A marketplace to buy and sell used bikes and scooters,Mittal,Stride Ventures,3000000.0,Series,2020,3.0
Bijak,2016.0,Gurugram,Technology,"It is a platform that gives agricultural commodity at better prices, increased working capital, and optimised logistics","Nukul Upadhye, Mahesh Jakhotia, Jitender Bedwal, Daya Rai, Nikhil Tripathi",RTP Global,12000000.0,Series,2020,12.0
Bugworks,2014.0,Bangalore,Technology,A drug discovery company that aims to discover novel treatment options for resistant bacterial infections,Anand Anandkumar,"University of Tokyo Edge Capital, Global Brain Corporation",7500000.0,Series,2020,7.5
DrinkPrime,2016.0,Bangalore,Technology,Water purifier subscription service,"Manas Ranjan Hota, Vijender Reddy","Abhishek Goyal, Bharat Jaisinghani, FirstCheque",3000000.0,Seed,2020,3.0
Yap,2016.0,Chennai,Technology,Banking and payment products-focused API platform,"Madhusudanan R, Muthukumar and Prabhu",BeeNext,4500000.0,Series,2020,4.5
UzhavarBumi,2017.0,Tamil Nadu,Technology,Provides fresh dairy products,"Vetrivel Palani, Paneerselvam",Angel Network,3000000.0,Series,2020,3.0
Tattva,2018.0,New Delhi,HealthCare,Sells its organic and beauty products via marketplace,"Megha Wadhwa, Karnesh Mahendru","Sukhbir Singh, Rakhee Singal",150000.0,Series,2020,0.15
Pariksha,2015.0,Pune,Technology,Platform for vernacular test-preparation,"Karanvir Singh, Utkarsh Bagri, Vikram Shekhawat, Deepak Choudhary","INSEAD Angels, IIT Kanpur Angels, Sixth Sense Ventures, Saahil Bhatia",3000000.0,Series,2020,3.0
DailyHunt,2016.0,Bangalore,"Fashion, Sports, Entertainment, Media & Arts",News aggregator,Virendra Gupta,"Bytedance, Falcon Edge, Goldman Sachs, Advent Management",24000000.0,Series,2020,24.0
NoBroker,2014.0,Bangalore,Real Estate,Online real estate rental startup,"Amit Kumar Agarwal, Akhil Gupta, Saurabh Garg",General Atlantic,30000000.0,Series,2020,30.0
Box8,2011.0,Mumbai,Technology,Enables to order food online,"Amit Raj, Anshul Gupta","IIFL Seed Ventures Fund, Menlo park",4000000.0,Series,2020,4.0
Capital Float,2013.0,Bangalore,Technology,Online platform that provides working capital finance to SMEs,"Gaurav Hinduja, Sashank Rishyasringa","Ribbit Capital, SAIF Partners, Sequoia Capital India, Amazon",15000000.0,Series,2020,15.0
ITILITE,2016.0,Bangalore,Technology,Platform for business travel,"Mayank Kukreja, Anish Khadiya","Greenoaks Capital, Vy Capital. Matrix Partners India",13000000.0,Series,2020,13.0
Morning Context,2016.0,Bangalore,Technology,A subscription-only digital media publisher,Byju Raveendran,Angel investors,3000000.0,Seed,2020,3.0
Aavenir,2019.0,Ahmedabad,Technology,Source-to-Pay Software,Ashish Bhandari,Accel,2000000.0,Seed,2020,2.0
Savvy Co op,2016.0,Bangalore,Technology,It connects patients with healthcare companies,Jen Horonjeff,Indie VC,3000000.0,Series,2020,3.0
BLive,2018.0,Bangalore,"Food, Hospitality, Tourism & Travel","It offers experiential, guided tours on smart electric bikes","Samarth Kholkar, Sandeep Mukherjee",Mumbai Angels Network,3000000.0,Series,2020,3.0
Yellow Messenger,2016.0,Bangalore,Technology,It offers conversational chatbots,Raghavendra Kumar Ravinutala,"Lightspeed Venture Partners, Lightspeed India Partners.",20000000.0,Series,2020,20.0
Toch,2016.0,Bangalore,Technology,AI based Video object detection and Tagging platform,"Vinayak Shrivastav, Saket Dandotia, Alok Patil",Inflection Point Ventures,400000.0,Series,2020,0.4
Ewar,2016.0,Bangalore,"Fashion, Sports, Entertainment, Media & Arts",E-sports and real-time gaming startup,"Parth Chadha, Rahul Singh","Jindal Steels, Jeet Banerjee",200000.0,Series,2020,0.2
Setu,2016.0,Bangalore,Technology,"Offers open APIs across four categories: bills, savings, credit, and payments.","Sahil Kini, Nikhil Kumar","Lightspeed Venture, Falcon Edge, Bharat Inclusive Technologies Seed Fund.",14259000.0,Series,2020,14.259
Wellthy Therapeutics,2016.0,Bangalore,Technology,It offers a digital therapeutics service,Abhishek Shah,Saama Capital,4000000.0,Series,2020,4.0
Power Gummies,2018.0,New Delhi,HealthCare,Offers health supplements related gummies,Divij Bajaj,Venture Catalysts,3000000.0,Series,2020,3.0
Locale ai,2019.0,Bangalore,Technology,It helps companies with moving assets  increase revenues and demand using real time location data and analytics,"Rishabh Jain, Aditi Sinha",Better Capital,3000000.0,Series,2020,3.0
FarEye,2016.0,New Delhi,Transport & Logistics,"It enables businesses to execute, track, predict and oprimize the movements of goods","Gaurav Srivastava, Gautam Kumar, Kushal Nahata","M12, Honeywell venture capital, Eight Roads Venture",24500000.0,Series,2020,24.5
Rebel Foods,2016.0,Bangalore,Technology,It runs internet kitchen,"Jaydeep Barman, Kallol Bannerjee",Coatue Management,50000000.0,Series,2020,50.0
BankBazaar,2008.0,Chennai,Technology,Online marketplace that gives customers instant customised offers on loans and credit cards,"Adhil Shetty, Arjun Shetty, Rati Shetty,","Amazon, Sequoia, Walden SKT Venture Fund",3800000.0,Series,2020,3.8
Porter,2014.0,Mumbai,Transport & Logistics,Logistics and fleet management,"Pranav Goel, Uttam Digga",Lightstone Global Funds,18370000.0,Series,2020,18.37
SugarBox,2016.0,Mumbai,Technology,Hyperlocal data distribution platform,Rohit Paranjpe,Zee Entertainment Enterprises Limited,68525000.0,Series,2020,68.525
Capital Float,2013.0,Bangalore,Technology,Online platform that provides working capital finance to SMEs,"Gaurav Hinduja, Sashank Rishyasringa","Amazon Inc`, Dinesh J Hinduja",4800000.0,Series,2020,4.8
Big Basket,2016.0,Bangalore,E-Commerce & Retail,Online grocery store,"Abhinay Choudhari, Hari Menon, Vipul Parekh, VS Sudhakar",Alibaba Holdings,60000000.0,Series,2020,60.0
Amica,2016.0,Bangalore,Technology,Neobanking startup,Jitendra Gupta,"Hummingbird Ventures, Bedrock Capital",2000000.0,Series,2020,2.0
Vedantu,2016.0,Bangalore,Technology,Onine learning platform,"Saurabh Saxena, Pulkit Jain, Anand Prakash, Vamsi Krishna",Legend Capital,12500000.0,Series,2020,12.5
Fingerlix,2016.0,Bangalore,"Food, Hospitality, Tourism & Travel","It provides ready-to-cook products such as batters, mixes, curries, dals, parathas etc.,","Shrikrishna Bharambe, Shripad Nadkarni, Varun Khanna, Abhijit Berde","Accel, Zephyr Peacock, Swiggy, RB Investments.",1834000.0,Series,2020,1.834
Plop,2016.0,Mumbai,Technology,It Provides an interactive fiction entertainment platform to entertain & educate Gen Z & Millennials in a language they understand,"Vineet Shetty, Anushka Shetty","Better Capital, LetsVenture, Rohit Chanana, Jayant Kadambi, Sunil Kumar Singhvi",3000000.0,Angel,2020,3.0
Zupee,2018.0,Bangalore,"Fashion, Sports, Entertainment, Media & Arts",It runs live quiz tournaments on its app.,"Malhi, Siddhant Saurabh",Matrix Partners,8000000.0,Series,2020,8.0
DeHaat,2012.0,Bangalore,Technology,Online marketplace for farming services and products,Shashank Kumar,Sequoia Capital India,12000000.0,Series,2020,12.0
Lido Learning,2016.0,Mumbai,Technology,Online teaching service,Sahil Sheth,Bace Capital,7500000.0,Series,2020,7.5
Aye Finance,2014.0,Gurugram,Technology,A finance lender to SMEs,"Vikram Jetley, Sanjay Sharma",Undisclosed,23850000.0,Series,2020,23.85
Swiggy,2014.0,Bangalore,Technology,Platform to order food online from restaurants and getting it delievered,"Nandan Reddy, Sriharsha Majety, Rahul Jaimini","Tencent, Ark Impact, Korea Investment Partners, Samsung Ventures, Mirae Asset Capital Markets",43000000.0,Series,2020,43.0
Akna Medical,2018.0,Bangalore,Technology,Provides supply solutions for surgical and pharmaceutical products.,"Saurabh Pandey, Mahadevan Narayanamoni",LGT Lightstone Aspada,7000000.0,Series,2020,7.0
Zomato,2016.0,Gurugram,Technology,Online food delivery and restaurant discovery platform,Deepinder Goyal,Pacific Horizon,5000000.0,Series,2020,5.0
RaRa Delivery,2016.0,Bangalore,Transport & Logistics,Provides same day delivery service for ecommerce businesses,Karan Bhardwaj,"Der Shing Lim, 500 startups",800000.0,Seed,2020,0.8
JusPay,2016.0,Bangalore,Technology,Online payment solutions,Vimal Kumar,Vostok Emerging Finance,21600000.0,Series,2020,21.6
Obviously AI,2018.0,Bangalore,Technology,It provides predictive insights to clients by leveraging their data,"Tapojit Debnath, Nirman Dave",Arka Venture Labs,3000000.0,Series,2020,3.0
Fingpay,2016.0,Mumbai,Technology,Provides payment solutions,"Pratyush Halen, Anuraag Agrawal",IvyCap Ventures,3500000.0,Series,2020,3.5
Recko,2017.0,Bangalore,Technology,The platform enables AI-powered reconciliation of digital transactions,"Prashant Border, Saurya Prakash Sinha",Vertex Ventures,6000000.0,Series,2020,6.0
Furlenco,2012.0,Bangalore,E-Commerce & Retail,Furniture rental startup,Ajith Mohan Karimpana,"Chowdry Associates, Lightbox",10000000.0,Series,2020,10.0
Mera Cashier,2019.0,Noida,Technology,App meant for small and micro businessmen to manage their transactions digitally,"Suneel Kumar, Gaurav Tomar, Sucharita Redd","Sukhbir Singh, India Accelerator, Boudhik Ventures, Shankar Nath, Shaurya Garg",150000.0,Series,2020,0.15
Kitchens Centre,2019.0,New Delhi,Technology,Offers solutions to cloud kitchens by providing commercial space and kitchen infrastructure to assisting with branding and other services,Lakshay Jain,AngelList India,500000.0,Seed,2020,0.5
Camp K12,2016.0,Gurugram,Technology,It connects students with tutors online,"Anshul Bhagi, Sandeep Bhagi","Matrix Partners, SAIF Partners",4000000.0,Seed,2020,4.0
MedGenome,2013.0,Bangalore,Technology,Genetic diagnostic testing company,Sam Santhosh,LeapFrog Investments,55000000.0,Series,2020,55.0
Ergos,2016.0,Bangalore,Technology,It enables farmers to digitise their foodgrain and also provide access to supply chain solutions,"Kishor Jha, Praveen Kumar",Aavishkar Capital,4598000.0,Series,2020,4.598
Nykaa,2012.0,Mumbai,E-Commerce & Retail,Deals in cosmetic and wellness products,Falguni Nayar,Steadview capital,13137000.0,Series,2020,13.137
Samadhan,2018.0,New Delhi,Finance,They help find solutions to insurance related issues,"Deepak Bhuvneshwari Uniyal, Shilpa Arora, Shailesh Kumar, Sanjay Aggarwal",Venture Catalysts,3000000.0,Seed,2020,3.0
SaScan,2016.0,Bangalore,Technology,Cancer diagnostics startup,Subhash Narayanan,Unicorn India ventures,3000000.0,Series,2020,3.0
Lido Learning,2016.0,Mumbai,Technology,Online teaching service,Sahil Sheth,"Pecus Capital, Madhur Deora",3000000.0,Series,2020,3.0
CureFit,2016.0,Bangalore,Technology,"Integrated platform for food, fitness and meditation.","Mukesh Bansal, Ankit Nagori",Temasek,115000000.0,Series,2020,115.0
Nimesa,2018.0,Bangalore,Technology,Cloud data managemnt solutions enterprise,"Tapesh Goyal, Rajesh Vaidhyanathan",Ideaspring capital,3000000.0,Series,2020,3.0
Design X,2016.0,Noida,Technology,Builds IoT based products,Preet Arjun Singh,ThinkNext LLC,200000.0,Seed,2020,0.2
Driftly Electric,2016.0,Bangalore,Technology,Electric vehicle startup,Sneha Roy,MG Motor India,3000000.0,Series,2020,3.0
Imstrong,2019.0,Bangalore,Technology,It is an online and live video-streaming platform that allows trainers and fitness enthusiasts to connect and engage in interactive online classes.,"Dilip Kumar, Selvan Thamarai, Deepti Nair",Rainmatter,400000.0,Seed,2020,0.4
Craftsvilla,2016.0,Mumbai,Technology,Online marketplace for ethnic wear,Monica Gupta. Manoj Gupta,Supera Investments,3900000.0,Series,2020,3.9
Rupifi,2020.0,Bangalore,Technology,Offers financial products for SMEs,"Anubhav Jain, Ankit Singh, Jawaid Iqbal","Ashneer Grover, Kunal Shah, Ramakant Sharma",3000000.0,Pre-seed,2020,3.0
SnackAmor,2016.0,Mumbai,"Food, Hospitality, Tourism & Travel",It offers various healthy snacks,Deepak Grover,Undisclosed,3000000.0,Seed,2020,3.0
Zealthy,2019.0,Bangalore,Technology,"It connects women to healthproviders for specialities like infertility, maternity etc.,","Rishi Malhotra, Akhil Gupta","KYT Ventures, First Cheque, AngelList",3000000.0,Seed,2020,3.0
CoinDCX,2016.0,Bangalore,Technology,A cryptocurrency trading platform,Sumit Gupta,"Polychain Capital, Bain Capital Ventures, HDR Group",3000000.0,Series,2020,3.0
NuNu TV,2016.0,Bangalore,"Fashion, Sports, Entertainment, Media & Arts",Kids-focussed Youtube channel,Byju Raveendran,Risers Accelerators,670000.0,Series,2020,0.67
QTalk,2016.0,Bangalore,Technology,Smart Phone Dialer,"Sagar Modi, Advaith Vishwanath","Accel India, Lightspeed Venture Partners",1600000.0,Seed,2020,1.6
Shadez,2018.0,Mumbai,"Fashion, Sports, Entertainment, Media & Arts",Paint Company,"Adarsh Anand, Amit Tiwari",Inflection Point Ventures,100000.0,Seed,2020,0.1
Excess2Sell,2016.0,Mumbai,E-Commerce & Retail,B2B Marketplace for Overstock & Surplus Inventory,Rajan Sharma,Gautham Madhavan,1000000.0,Series,2020,1.0
Stanplus,2016.0,Hyderabad,Technology,Ambulance service,Prabhdeep Singh,Pegasus FinInvest,1500000.0,Series,2020,1.5
Pitstop,2016.0,Bangalore,Technology,Doorstep car service,Mihir Mohan mishra,TPG-backed Group Landmark,2500000.0,Series,2020,2.5
Univariety,2015.0,Hyderabad,Technology,Online marketplace that provides career counselling and college guidance,Jaideep Gupta,Info Edge,1100000.0,Series,2020,1.1
Peel Works,2010.0,Mumbai,Technology,E-commerce for corner/retail stores.,"Sachin Chhabra, Nidhi Ramachandran",CESC Ventures,3000000.0,Series,2020,3.0
CoreStack,2016.0,Chennai,Technology,Enterprise cloud governance technology startup,"Ezhilarasan Natarajan, Sabapathy Arumugam, Krishnakumar Narayanan, Thiruvalluvar NB",Naya Ventures,8500000.0,Series,2020,8.5
Vivriti Capital,2017.0,Chennai,Technology,Digital lending startup,"Gaurav Kumar, Vineet Sukumar",LGT Lightstone Aspada,50000000.0,Series,2020,50.0
Agnikul,2016.0,Chennai,Technology,"It designs, fabricates, tests and launch orbital class launch vehicles",Srinath Ravichandran,pi Ventures,3148000.0,Series,2020,3.148
Fintso,2020.0,Bangalore,Technology,Wealth management platform,"George Mitra, Rajan Pathak","Rajeev Juneja, Pratul Shroff, Dilip Khandelwal, Piyush Gupta",2600000.0,Series,2020,2.6
Khatabook,2016.0,Bangalore,Technology,It helps SMEs to maintain their accounts and ledger online.,Ravish Naresh,Mahendra Singh Dhoni,3000000.0,Series,2020,3.0
Smart Coin,2015.0,Bangalore,Technology,Consumer lending startup,"Amit Chandel, Rohit Garg, Vinay Kumar, Jayant Upadhyay",LGT LightstoneAspada,7000000.0,Series,2020,7.0
ZunRoof,2016.0,Gurugram,Technology,"It specialises in solar rooftop design, installation, and management using technology","Pranesh Chaudhary, Sushant Sachan",Godrej Investments,3000000.0,Series,2020,3.0
Shop101,2015.0,Bangalore,E-Commerce & Retail,Enables entrepreneurs to sell online,"Abhinav Jain, Aditya Gupta","Stellaris Venture Partners, Unilever Ventures, Kalaari Capital, Vy Capital",3900000.0,Series,2020,3.9
OM Bhakti,2016.0,Bangalore,E-Commerce & Retail,A puja cotton-wicks manufacturing startup,"Sridhar Joshi, Prashant Kulkarni",Venture Catalysts,3000000.0,Seed,2020,3.0
Lal10,2016.0,Uttar Pradesh,E-Commerce & Retail,It helps Indian artisans and SMEs reach out to global retailers,"Maneet Gohil, Sanchit Govil, Albin Jose",Sorenson Impact,1100000.0,Series,2020,1.1
Anaxee Digital Runner,2016.0,Indore,Technology,A tech-enabled ID verification and data collection startup,"Govind Agrawal, Arti Agrawal",Orios Venture Partners,3000000.0,Series,2020,3.0
CollegeKhabri,2019.0,Bhopal,Technology,Platform is an end-to-end college and career counselling platform for students,Arshi Khan,Vishal Dixit,3000000.0,Series,2020,3.0
Ola Electric,2016.0,Bangalore,Technology,Electric vehicle,"Ankit Jain, Anand Shah",Pawan Munjal Family Trust Fund,1000000.0,Series,2020,1.0
Multi Living,2016.0,Mumbai,Real Estate,"It curates apartments from the homeowners, performs the quality check and offers the homes with built-in services to the potential tenants",Pankaj Singh,Lodha Ventures,6000000.0,Series,2020,6.0
FamPay,2016.0,Bangalore,Technology,"It allows parents to send money to their kids below the age of 18, which they can spend securely under parent supervision.",Kush Taneja,"Y Combinator, Venture Highway, Sequoia India, Global Founders Capital",4700000.0,Seed,2020,4.7
UnboxRobotics Labs,2016.0,Bangalore,Technology,Automated flexible parcel sorting solutions for logistics providers,Pramod Ghadge,"Arali Ventures, CIIE.CO",500000.0,Seed,2020,0.5
Karbon Card,2016.0,Bangalore,Technology,Specialisde corporate cards for startups,"Pei-fu Hsieh, Amit Jangir","Kunal Shah, Amrish Rau, Jitendra Gupta",2000000.0,Seed,2020,2.0
Airmeet,2016.0,Bangalore,Services,"A platform to host, discover, and attend fully remote events like conferences and professional meet-ups","Lalit Mangal, Vinay Jaasti, Manoj Singh",Accel India,3000000.0,Series,2020,3.0
Innerchef,2016.0,Gurugram,Technology,Cloud kitchen platform,Rajesh,Mistletoe,1000000.0,Series,2020,1.0
Epigamia,2015.0,Mumbai,E-Commerce & Retail,Flavoured and greek yoghurt brand,Rohan Mirchandani,KA Enterprise,3000000.0,Series,2020,3.0
StyleNook,2016.0,Mumbai,E-Commerce & Retail,Marketplace for fashionable apparel,Lathika Pai,"Lead Angels Network, Stanford Angels",3000000.0,Series,2020,3.0
Callido Learning,2016.0,Mumbai,Technology,Provides a structured educational approach to critical thinking and problem solving skills,Sriram Subramanian,Education Catalyst Fund,3000000.0,Series,2020,3.0
Soxytoes,2016.0,New Delhi,E-Commerce & Retail,Online store to buy various types of socks including funky and colorful socks,"Vidushi Kajaria, Aayush Goenka",Angel network,3000000.0,Series,2020,3.0
F5,2018.0,New Delhi,Technology,Retail Aggregator,"Raghav Arora, Lalit Kumar Aggarwal",LetsVenture investors,3000000.0,Seed,2020,3.0
Paper Boat,2013.0,Bangalore,"Food, Hospitality, Tourism & Travel",Ecommerce platform for beverages and snacks,"Neeraj Kakkar, James Nutall, Suhas Misra, Neeraj Biyani","Advent Management, A91 Emerging Fund, Trifecta Venture",4049500.0,Series,2020,4.0495
Strata,2019.0,Bangalore,Technology,Real estate investment platform,"Sudarshan Lodha, Priyanka Rathore","SAIF Partners, Mayfield India",1500000.0,Seed,2020,1.5
Salesken,2016.0,Bangalore,Technology,Provides sales professionals with intelligence on various aspects of the sales pitch,"Sreeraman Vaidyanathan, Surga Thilakan",Sequoia India,8000000.0,Series,2020,8.0
Arya,2016.0,Noida,Technology,Provides post-harvest services across the agricultural value chain,Prasanna Rao,LGT Lightstone Aspada,6000000.0,Series,2020,6.0
Leap Finance,2016.0,Bangalore,Technology,Provides education loans to students based on the student’s future income,"Vaibhav Singh, Arnav Kumar",Sequoia India,5500000.0,Series,2020,5.5
Sleepy Owl,2016.0,New Delhi,"Food, Hospitality, Tourism & Travel","It sells ready to drink cold brew coffees, brew boxes and packs.","Ajai Thandi, Arman Sood, Ashwajeet Singh",Rukam Capital,3000000.0,Series,2020,3.0
Tricog,2015.0,Bangalore,Technology,Provides virtual cardiology services through its AI-powered healthcare platforms,"Charit Bhograj, Zainul Charbiwala, Udayan Dasgupta, Abhinav Gujjar","UTEC-The University of Tokyo Edge Capital, Aflac Ventures, LLC, Dream Incubator, TeamFund",10500000.0,Series,2020,10.5
GogoBus,2016.0,New Delhi,Technology,Inter-City Mobility Startup,Amit Gupta,Ixigo,3000000.0,Series,2020,3.0
Trell,2016.0,Bangalore,E-Commerce & Retail,Allows users to share their travel experiences,"Pulkit Agrawal, Prashant Sachan, Arun Lodhi, Bimal Kartheek Rebba, Nirav Sheth","Sequoia’s Surge, Fosun RZ",4000000.0,Series,2020,4.0
Spaciya Consultants,2016.0,Noida,Real Estate,Real estate consultancy firms,Ajit Panda,Alok Garg,500000.0,Series,2020,0.5
Bounce,2014.0,Bangalore,Real Estate,Offers a variety of bikes and scooters that can be rented on a subscription basis,"Vivekananda Hallekere, Anil Giri Raju, Arun Agni",InnoVen Capital,6500000.0,Series,2020,6.5
Neeman,2017.0,Bangalore,E-Commerce & Retail,An eco-conscious footwear brand making comfortable shoes using Merino Wool,"Taran Chhabra, Amar Preet Singh",Anicut Angel Fund,1000000.0,Series,2020,1.0
Chqbook,2017.0,Gurugram,Technology,"Marketplace for small business owners, offering them products around lending, credit cards etc","Vipul Sharma, Rajat Kumar, Sachin Arora, Mohit Goel",Aavishkaar Capital,5000000.0,Series,2020,5.0
SMEcorner,2014.0,Mumbai,Technology,Financial lending firm to SMEs,"Bhatia, Sneha Shah",Paragon Partners,30000000.0,Series,2020,30.0
Oda Class,2016.0,Bangalore,Technology,"It offers content and material via video, adopting a dual-teacher model with IIT and NIT alumni","Li Yong, Shushant Srivastava",Yuanfudao,3000000.0,Series,2020,3.0
Spinny,2015.0,Haryana,Technology,Used car retailing platform,"Niraj Singh, Mohit Gupta, Ramanshu Mahuar","Nandan Nilekani, Sanjeev Aggarwal",43700000.0,Series,2020,43.7
goStops,2012.0,New Delhi,"Food, Hospitality, Tourism & Travel",A premium chain of youth hostels catering to the millennials,"Pallavi Agarwal, Pankaj Parwanda",Atraxn Partners.,3000000.0,Series,2020,3.0
Umeed Housing,2016.0,Haryana,Technology,Housing finance company,Ashutosh Sharma,Morgan Stanley Private Equity Asia,23000000.0,Series,2020,23.0
Vogo,2016.0,Bangalore,Transport & Logistics,A scooter-sharing platform allowing users to rent a two-wheeler from specific designated pick up points,"Anand Ayyadurai, Padmanabhan Balakrishnan, Sanchit Mittal",Lightstone Aspada,20000000.0,Series,2020,20.0
Flick Stree,2016.0,Mumbai,Technology,Artificial intelligence-based video publishing network,Saurabh Singh,Samsung Venture Investment,3000000.0,Series,2020,3.0
Qure ai,2016.0,Mumbai,Technology,Provides interpretations of radiology scans,"Prashant Warier, Pooja Rao",Sequoia India,16000000.0,Series,2020,16.0
MinionLabs,2016.0,Bangalore,Technology,It leverages a Machine Learning-based approach to generate a comprehensive report on predictive analytics,Gokul Shrinivas,Indian Angel Network,3000000.0,Series,2020,3.0
Josh Talks,2015.0,Haryana,"Fashion, Sports, Entertainment, Media & Arts",Community of young individuals providing a platform to showcase their stories,"Supriya Paul, Shobhit Banga",Media Development Investment Fund,1500000.0,Series,2020,1.5
PhoneParLoan,2015.0,New Delhi,Technology,Provides easy loans,Ringaile Noq,Accelerator MOX,3000000.0,Series,2020,3.0
RailYatri,2011.0,Noida,"Food, Hospitality, Tourism & Travel",A complete Indian railways app,"Manish Rathi, Kapil Raizada, Sachin Saxena","Nandan Nilekani, Samsung Venture Investment Corporation",13800000.0,Series,2020,13.8
AjnaLens,2014.0,Thane,Technology,"It leverages technologies such as AR, VR & AI to offer hardware in areas such as education and defence","Pankaj Raut, Abhishek Tomar, Abhijit Patil","Maharashtra Defence, Aerospace Venture Fund (MDAVF)",1500000.0,Series,2020,1.5
Pepper,2017.0,Mumbai,Technology,End to end content creation platform,Anirudh Singla and Rishabh Shekhar,"Kunal Bahl, Rohit Bansal",306900.0,Seed,2020,0.3069
Rupeek,2015.0,Bangalore,Technology,An asset backed online lending platform,"Amar Prabhu, Ashwin Soni, Sumit Maniyar","GGV Capital, Bertelsmann India Investments, Binny Bansal, Sequoia India, Accel Partners",30000000.0,Series,2020,30.0
iMerit,2012.0,Kolkata,Technology,Turns information into data that is usable for machine learning processes,Radha Basu,CDC Group Plc,20000000.0,Series,2020,20.0
BharatPe,2018.0,New Delhi,Technology,Digital payments platform,Ashneer Grover,Ribbit Capital,75000000.0,Series,2020,75.0
Invideo,2016.0,Bangalore,"Fashion, Sports, Entertainment, Media & Arts",Video production and editing platform,Sanket Shah,Sequoia Capital’s Surge,2500000.0,Series,2020,2.5
AvalonMeta,2017.0,Bangalore,Technology,It combines higher education and competitive gaming,"Varun Mayya, Shashank Udupa, Abhinav Arora",Peerplays,420000.0,Series,2020,0.42
Near Store,2016.0,Mumbai,E-Commerce & Retail,Enables a shop to create an online presence,Byju Raveendran,Sauce.vc,300000.0,Seed,2020,0.3
ElecTorq,2016.0,New Delhi,Technology,Electric vehicle startup,Anubhav Sharma,AdvantEdge,3000000.0,Series,2020,3.0
Prayaan Capital,2016.0,Chennai,Technology,"NBFC that lends to micro, small, and medium-sized enterprises (MSMEs)","Madhan Mohan , Akash Chelvam",Accion Venture Lab,1200000.0,Seed,2020,1.2
Sanfe,2016.0,New Delhi,Other,Women health care and wellness product,"Archit Agarwal, Harry Sehrawat","SucSEED Venture Partners, BIRAC, Elixir Pharma, Titan Capital",1100000.0,Series,2020,1.1
